nome_do_aluno_diplomado,seis_digitos_centrais_do_cpf_do_aluno_diplomado,nome_curso_superior,codigo_emec_curso_superior,nome_da_ies_expedidora_do_diploma,codigo_emec_da_ies_expedidora_do_diploma,nome_da_ies_registradora_do_diploma,codigo_emec_da_ies_registradora_do_diploma,data_de_ingresso_no_curso,data_de_conclusao_do_curso,data_da_expedicao_do_diploma,data_do_registro_do_diploma,identificacao_do_numero_da_expedicao,numero_registro_de_diploma
WALLAFY RIBAS DE LIMA,***.063.351-**,ADMINISTRAÇÃO,90047,Universidade Federal de Goias,584,Universidade Federal de Goias,584,2012-1,2020-06-15,2020-06-17,2020-06-17,3270,143195
JOÃO LUIZ DE CARVALHO VIEIRA,***.725.291-**,ADMINISTRAÇÃO,90047,Universidade Federal de Goias,584,Universidade Federal de Goias,584,2014-1,2020-06-15,2020-06-17,2020-06-17,3271,143196
ALAN MAURICIO SOARES DE MELO ALVES,***.474.561-**,CIÊNCIAS ECONÔMICAS,80638,Universidade Federal de Goias,584,Universidade Federal de Goias,584,2012-1,2020-06-15,2020-06-17,2020-06-17,3272,143197
MILENA ARAUJO DOS SANTOS,***.968.971-**,ENFERMAGEM,14091,Universidade Federal de Goias,584,Universidade Federal de Goias,584,2016-1,2020-06-15,2020-06-17,2020-06-17,3273,143198
CHRISTIAN PEREIRA DOS SANTOS,***.261.031-**,ENGENHARIA FLORESTAL,123425,Universidade Federal de Goias,584,Universidade Federal de Goias,584,2013-1,2020-06-22,2020-06-24,2020-06-24,3274,143199
PAULA SILVA MATOS,***.184.241-**,FARMÁCIA,14092,Universidade Federal de Goias,584,Universidade Federal de Goias,584,2014-2,2020-06-19,2020-06-24,2020-06-24,3275,143200
GABRIEL PEREIRA DE CARVALHO,***.116.501-**,DIREITO,14109,Universidade Federal de Goias,584,Universidade Federal de Goias,584,2015-1,2020-06-19,2020-06-24,2020-06-24,3276,143201
ASHLEE CONSTANCE ERICA ESTWICK,***.009.921-**,COMUNICAÇÃO SOCIAL,18953,Universidade Federal de Goias,584,Universidade Federal de Goias,584,2014-1,2020-06-26,2020-06-29,2020-06-29,3277,143202
